commit	val_bpb	memory_gb	mfu	tok_per_sec	num_steps	num_params_M	batch_size	final_loss	status	description
e2ba661	1.135331	7.1	75.5	59000	1105	200.7	2	3.042	keep	SHORT_WINDOW 1024→256 (hypothesis: smaller sliding window cuts attention FLOPs on 9/12 layers by 4x for more tokens in 20min; evidence: modded-nanogpt speedrun uses 128-384 windows): val_bpb 1.142→1.135 (0.006 improvement). 1105 steps/72.4M tokens vs 1132/74.2M — slightly fewer tokens (batch=2 autotune regression) but quality improved. Smaller context window forces each layer to learn local patterns efficiently.
5409686	1.118681	8.6	86.3	68430	1261	200.7	4	2.839	keep	Force batch=4 (skip eager-mode autotune which wrongly picked batch=2; hypothesis: batch=4 works fine in compiled mode with flex_attention using only 8.8GB; evidence: exp#55 showed 7.3GB at batch=2 compiled): val_bpb 1.135→1.119 (0.017 improvement). 1261 steps/82.6M tokens (up from 1105/72.4M at batch=2). MFU 86.3%. Batch=4 restores 14% more tokens processed in same 20min budget.
7ce6198	1.135252	11.9	79.6	64500	1184	200.7	8	2.829	discard	Force batch=8 (hypothesis: 3.4GB VRAM headroom means batch=8 fits for more throughput; evidence: exp#56 peak=8.8GB at batch=4): val_bpb 1.119→1.135 WORSE. Peak VRAM 12.2GB (nearly OOM). tok/sec dropped 68K→64K (-6%) and MFU 86→80% because larger forward pass offsets reduced grad_accum. Fewer tokens (77.6M vs 82.6M). batch=4 is optimal — batch=8 too memory-intensive.
128622e	1.132081	8.9	85.3	60347	1117	214.9	4	2.897	discard	DEPTH 12→14 same 768 dim (AR 64→54, 215M params) with MXFP8+flex_attention (hypothesis: 2 extra layers add capacity using 3.4GB VRAM headroom; evidence: prev d14 failed pre-MXFP8 but now have 2.3x throughput): val_bpb 1.119→1.132 WORSE (+0.013). 1117 steps/73.2M tokens vs 1261/82.6M at d12 — 12% fewer tokens outweigh capacity from 2 extra layers. MFU 85.3% still great but per-step cost too high. Confirms d12 is optimal depth for this compute budget.
f2f6de6	1.129355	8.6	83.6	68244	1242	200.7	4	2.758	discard	EMA weights during last 30% (decay=0.98, every 5 steps, CPU-side) (hypothesis: SWA smooths late-training trajectory for better minimum; evidence: SWA literature claims 0.01-0.02 BPB gain): val_bpb 1.119→1.129 WORSE (+0.011). EMA over-averages the converged weights — blends strong final params with weaker earlier ones. MFU 86→84% from CPU copy overhead. Also 1242 vs 1261 steps (lost 19 steps). EMA decay=0.98 too aggressive for only ~370 EMA steps — would need decay>0.999 or smaller window.
33b89a4	1.229732	8.6	80.0	64044	5125	200.7	4	3.135	discard	Dynamic grad_accum curriculum (1→2→4 at 0/50/80% progress) (hypothesis: small batch early = more steps + noise regularizer; large batch late = precise convergence; evidence: exp#5 small batch helped): val_bpb 1.119→1.230 MUCH WORSE (+0.111). 5125 steps but most with batch=8K tokens too noisy for Muon — optimizer needs sufficient batch for Newton-Schulz orthogonalization quality. MFU dropped 86→57% in phase 1. Small batch hurts Muon more than SGD — batch=65K (grad_accum=8) is load-bearing for this optimizer.
75a552c	1.146746	8.7	91.7	68501	1253	232.8	4	2.967	discard	Heterogeneous MLP-only layers (odd layers 1,3,5,7,9,11 = MLP-only, no attention) + wider 768→896 dim (hypothesis: remove attention from alternate layers and reinvest in width; evidence: 'attention not needed every layer' literature): val_bpb 1.119→1.147 WORSE (+0.028). MFU 86→92% (huge throughput gain from MLP-only layers). Same tokens (82.1M vs 82.6M). But 6/12 layers without attention can't model long-range dependencies — every-layer attention is load-bearing for language modeling at this 200M scale. Width gain (768→896) doesn't compensate for halved attention capacity.
aba3d08	1.242453	11.9	43.6	31025	570	207.8	4	3.186	discard	Differential attention: double c_q to 12 sub-heads, keep 6 KV heads (GQA 2:1), subtract output pairs with learned lambda=0.8 (hypothesis: diff attention cancels noise for better per-token learning in undertrained regime; evidence: ICLR 2025 paper): val_bpb 1.119->1.242 MUCH WORSE (+0.124). Throughput collapsed 68K->31K tok/sec (-54%), MFU 86->44%, only 37.4M tokens (vs 82.6M). Peak VRAM 12.1GB (near OOM). Doubled Q projection + 12 attention sub-heads too expensive — attention FLOPs with sliding window were NOT negligible as assumed. Diff attention needs lighter implementation (e.g. head-dim splitting not head-count doubling) to avoid throughput penalty.
8031c2f	1.161193	8.6	65.9	65500	995	200.7	4	2.930	discard	Window warmup 3-phase (128→256→512 over training) (hypothesis: progressive window growth gives faster early steps + better final quality; evidence: modded-nanogpt speedrun uses window warmup): val_bpb 1.119→1.161 WORSE (+0.042). Two torch.compile recompilations at phase transitions cost ~6 min (3 min each at 33%/67% progress), reducing total tokens 82.6M→65.2M (-21%). MFU dropped 86→66% average. Recompilation overhead dominates any quality benefit from dynamic windows. Window warmup incompatible with torch.compile without prewarming all graph variants.
5474c04	1.182850	10.7	78.9	64200	1175	277.9	4	2.941	discard	3 VE tables with per-layer learned mixing (hypothesis: multiple VE tables let layers specialize token→value mappings adding capacity without FLOPs; evidence: speedrun uses 5 VE tables): val_bpb 1.119→1.183 WORSE (+0.064). 277.9M params (+77M) used 10.9GB VRAM. MFU 86→79% and tok/sec 68K→64K. 77M tokens (vs 82.6M baseline -7%). Extra capacity from 2 more VE tables did NOT compensate for throughput loss. Per-layer mixing scalars may need gating (speedrun uses per-head sigmoid gates). Also 3x embedding lookups are bandwidth-heavy.
e6506ec	1.158224	8.6	80.1	66500	1193	200.7	4	2.980	discard	Hourglass FFN replacing SwiGLU: 2 residual sub-MLPs (hidden=1536 same params/FLOPs; hypothesis: deeper FFN with residuals better function approximator per arxiv 2602.06471; evidence: paper proves outperforms at ≤400M): val_bpb 1.119→1.158 WORSE (+0.039). MFU 86→80% and tok/sec 68K→66K. SwiGLU gating (silu*gate) is load-bearing — selective information routing beats residual depth at our scale/budget.
bb0fbb2	1.127781	9.8	78.9	64000	1173	200.8	4	2.980	discard	Causal depthwise conv1d (kernel=4) parallel to attention in each Block (hypothesis: local token mixing complements sliding window attention; evidence: H3/Mamba/Conformer use short convs): val_bpb 1.119→1.128 WORSE (+0.009). MFU 86→79% and tok/sec 68K→64K (-6%). Conv overhead costs 5.7M tokens (82.6→76.9M) which outweighs any quality benefit from local mixing. Attention already handles local context well enough.
ff18e7b	1.125900	8.6	85.3	71200	1322	200.7	4	2.833	discard	WINDOW_PATTERN SSSL→S (11 sliding + 1 forced-full last layer; hypothesis: fewer full attn layers → more tokens via throughput gain; evidence: 8 consecutive discards all from throughput loss): val_bpb 1.119→1.126 WORSE (+0.007). Throughput improved 68K→71K tok/sec (+5%) and 82.6→86.6M tokens (+5%). But losing 2 full-attention layers (3,7) hurt quality more than extra tokens helped. SSSL pattern's every-4th-layer full attention is load-bearing for long-range modeling.
356b419	1.115866	9.6	91.9	71000	658	200.7	4	2.980	keep	TOTAL_BATCH_SIZE 2^16→2^17 (hypothesis: 2x batch gives higher quality Muon Newton-Schulz gradients; evidence: Muon scaling paper + exp#60 proved small batch hurts): val_bpb 1.119→1.116 (0.003 improvement). MFU 86→92% (+7pp!) and tok/sec 68K→71K. 86.2M tokens (up from 82.6M +4.4%). 658 steps (halved from 1261). Larger batch saturates GPU better (16 grad_accum vs 8) AND improves Muon update quality. Breaks 10-experiment plateau!
c7c0446	1.167370	9.5	90.0	72000	341	200.7	4	3.087	discard	TOTAL_BATCH_SIZE 2^17→2^18 (hypothesis: continue batch scaling since 2^16→2^17 improved; evidence: exp#68): val_bpb 1.116→1.167 MUCH WORSE (+0.051). 89.4M tokens (more) but only 341 steps — too few optimizer updates for convergence. 2^18 overshoots optimal batch-step trade-off. 2^17 is the sweet spot: enough steps (658) + enough batch quality.
c2bf3fb	1.123433	9.5	87.2	71000	653	200.7	4	2.919	discard	WARMDOWN_RATIO 0.5→0.3 (hypothesis: with fewer steps at 2^17 batch need more at full LR; evidence: warmdown tuned at 2^16/1261 steps): val_bpb 1.116→1.123 WORSE (+0.007). Shorter cooldown (30% vs 50%) doesn't give model enough time to settle. Even at 658 steps, 50% warmdown is optimal — the cosine decay is load-bearing for final convergence quality.
