commit	val_bpb	memory_gb	mfu	tok_per_sec	num_steps	num_params_M	batch_size	final_loss	status	description
3087aeb	2.335670	5.5	58.1	37700	180	162.1	4	5.155	keep	baseline (SwiGLU d12 ClimbMix) — BROKEN cooldown: loss 1.50→5.15 during warmdown
81dd182	2.494669	5.5	53.7	33477	167	162.1	4	3.811	discard	constant WD (remove decay) + WARMDOWN_RATIO 0.4→0.3 — warmdown still broken
8da6023	2.141833	5.5	58.1	36982	180	162.1	4	4.950	keep	WARMDOWN_RATIO 0.4→0.0 (no warmdown): loss STILL explodes ~step160 (1.5→5.0) proving instability is NOT warmdown-related but model/optimizer bug
0708cec	2.238187	5.5	53.2	33522	166	162.1	4	3.136	discard	grad clip max_norm=1.0 + WARMDOWN_RATIO=0.4: loss spike reduced (5.0→3.1) but NOT eliminated, clip alone insufficient — need to fix root cause (Q/K weight growth per Moonshot paper)
345ec03	1.832082	5.5	54.9	32782	653	162.1	4	3.235	keep	Hypothesis: smaller batch (2^18→2^16) = more optimizer steps. Evidence: baseline uses large batch but we have only 180 steps. Result: val_bpb 2.14→1.83 (big win), loss still explodes at ~42M tokens proving data issue not optimizer.
9182733	1.374661	5.5	56.2	35083	665	162.1	4	3.247	keep	Bottleneck: instability at ~42M tokens (loss 0.75→3.2). Hypothesis: ClimbMix sorted by cluster_id causes distribution shift triggering Muon momentum cascade. Shuffling documents within shards randomizes topic order. Evidence: explosion at same token count regardless of batch/warmdown/clip. Result: val_bpb 1.83→1.37 (huge win). NO loss explosion. Training loss 3.25 (vs 0.77 unshuffled) because model can't overfit to single topic cluster. Proves instability was 100% data-ordering.
db01468	1.294054	5.5	54.7	36403	648	162.1	4	3.098	keep	Bottleneck: no LR cooldown (WARMDOWN_RATIO=0.0). Hypothesis: warmdown will now work since data-ordering instability is fixed by shuffle. Evidence: exps 1-3 showed warmdown 'broken' but that was data bug. Exp 6 proved shuffle fixes it. Result: val_bpb 1.37→1.29. Warmdown works perfectly (lrm 1.0→0.0). Training stable throughout. Confirms warmdown was never broken — data ordering was.
cb3cf94	1.282745	5.5	55.4	36076	658	162.1	4	3.165	keep	FINAL_LR_FRAC 0.0→0.1 (hypothesis: Muon docs recommend 0.1x floor not 0 for better final convergence, evidence: Muon GitHub): val_bpb 1.294→1.283, 658 steps (vs 648), confirms LR floor helps — model keeps learning during warmdown instead of stalling
1803cd0	1.295032	5.5	54.9	35715	1293	162.1	4	3.265	discard	TOTAL_BATCH_SIZE 2^16→2^15 (hypothesis: halve grad accum 8→4, evidence: exp5 batch reduction helped): val_bpb 1.283→1.295 WORSE. 2x steps (1293) but same total tokens (42M). Smaller batch hurts convergence without improving throughput.
75f1819	1.340624	7.8	55.2	24300	456	226.5	4	3.309	discard	DEPTH 12→14 (768→896 dim, 226M params) (hypothesis: 3GB VRAM headroom → bigger model, evidence: ratio-8 scaling heuristic): val_bpb 1.283→1.341 WORSE. Only 456 steps (vs 658) and 30M tokens (vs 43M) — bigger model processes fewer tokens in 20min. Capacity gain doesn't offset reduced training.
c459e32	1.268992	5.5	58.1	37040	689	162.1	4	3.046	keep	MATRIX_LR 0.03→0.04 (hypothesis: higher Muon LR for faster convergence per step, evidence: Muon community best practice is 0.04): val_bpb 1.283→1.269 (0.014 improvement). 689 steps vs 658, stable training throughout. Confirms our LR was suboptimal — 0.04 is better for this scale.
633fd68	1.269490	5.5	57.9	36840	685	162.1	4	3.146	discard	MATRIX_LR 0.04→0.05 (hypothesis: even higher Muon LR for faster convergence, evidence: 0.03→0.04 gave 0.014 improvement): val_bpb 1.269→1.270 — NO improvement (delta 0.0005). 0.04 is near-optimal for this model scale. LR sweep complete: 0.03<0.04≈0.05.
b2e1bcc	1.264656	5.5	57.9	36900	687	162.1	4	3.044	keep	WARMDOWN_RATIO 0.3→0.5 (hypothesis: longer cooldown gives more gradual LR decay for better final convergence, evidence: standard practice for short training): val_bpb 1.269→1.265 (0.004 improvement). With 50% warmdown LR decays earlier (lrm=0.30 at 89%) allowing smoother settling.
756e18c	1.261789	5.5	57.9	36830	687	162.1	4	3.037	keep	WEIGHT_DECAY 0.2→0.1 (hypothesis: less regularization helps since model underfits with final_loss=3.04, evidence: short training unlikely to overfit): val_bpb 1.265→1.262 (0.003 improvement). Lower WD lets weights grow faster, better convergence in limited steps.
e5ec918	1.265620	5.5	57.6	36648	683	162.1	4	3.099	discard	EMBEDDING_LR 0.4→0.6 (hypothesis: embeddings are 47% of params and undertrained in 687 steps; higher LR accelerates convergence; evidence: landscape scan): val_bpb 1.262→1.266 WORSE. 0.6 overshoots — 0.4 is near-optimal for embedding LR.
7b1c5a1	0.000000	0.0	0.0	0	0	0.0	0	0.000	crash	weight tying (lm_head.weight=wte.weight): loss stuck at 10.82 — shared weight gets embedding LR 0.4 which is 100x too high for output projection role; need separate LR scaling or different tying approach
6b14356	1.278175	5.5	57.6	36638	682	162.1	4	3.096	discard	UNEMBEDDING_LR 0.004→0.02 (hypothesis: lm_head 24% of params undertrained at low LR; 5x increase should improve output projection learning; evidence: weight tying crash proved 0.4 too high so 0.02 conservative): val_bpb 1.262→1.278 WORSE. Higher unembedding LR overshoots — 0.004 is near-optimal for separate lm_head.
dc5db03	1.318778	5.5	56.6	36081	672	162.1	4	3.198	discard	ReLU² MLP instead of SwiGLU (hypothesis: 2 larger matmuls better GPU utilization than 3 smaller; evidence: speedrun leaderboards use ReLU²): val_bpb 1.262→1.319 MUCH WORSE. SwiGLU's gated activation is clearly superior at this scale/budget. ReLU² lacks the gating mechanism that helps SwiGLU converge faster.
6d75a72	1.265325	5.5	57.9	36727	686	162.1	4	3.117	discard	Muon NS iterations 5→4 (hypothesis: fewer orthogonalization steps save compute per Turbo-Muon paper; evidence: arxiv 2512.04632): val_bpb 1.262→1.265 WORSE (delta 0.004). Optimization quality degraded — 4 NS steps insufficient without AOL preconditioner. Need full Turbo-Muon implementation not just fewer steps.
aaf9a1f	1.269199	5.5	57.9	37063	685	162.1	4	3.121	discard	WARMUP_RATIO 0.05→0.02 (hypothesis: shorter warmup gives 20 more steps at full LR; evidence: QK-Norm + softcap stabilize early training): val_bpb 1.262→1.269 WORSE. Shorter warmup causes early gradient noise that hurts learning — 5% warmup (34 steps) is needed for stable ramp-up even with QK-Norm.
620a7a7	1.233397	7.0	51.7	35300	652	200.7	4	2.930	keep	value embeddings: shared nn.Embedding(50257x768) added to attention values at all 12 layers (hypothesis: adds 38.6M 'free FLOP' params using 3GB VRAM headroom for direct token→value path; evidence: VE technique shown to boost small model quality): val_bpb 1.262→1.233 (0.028 improvement). MFU 58→52% (embedding lookup overhead) but capacity gain dominates. 200.7M params vs 162.1M. Confirms VE adds complementary capacity to x0 skip connections.
b46cc9e	1.229346	7.0	53.0	35900	670	200.7	4	2.913	keep	cosine warmdown instead of linear (hypothesis: cosine keeps LR higher during early warmdown for more learning per step; evidence: cosine widely adopted in GPT-3/LLaMA/Chinchilla): val_bpb 1.233→1.229 (0.004 improvement). 670 steps vs 652 (cosine maintains higher LR longer → more effective steps). Confirms cosine > linear for warmdown.
7e681dd	1.229203	7.0	53.2	36100	670	200.7	4	2.909	discard	WARMDOWN_RATIO 0.5→0.6 + autotune refresh with expanded batch candidates (hypothesis: longer cosine cooldown improves convergence; evidence: 0.3→0.5 helped by 0.004): val_bpb 1.229→1.229 NO improvement (delta <0.001). Autotune still chose batch_size=4. 0.5 is near-optimal warmdown ratio — further increase gives diminishing returns.
9a8eaa3	1.253550	7.0	52.3	35247	647	200.7	4	3.080	discard	U-Net skip connections with sigmoid gating (layer 0→11, 1→10, etc., init -1.5 sigmoid≈0.18) (hypothesis: skip connections improve gradient flow/feature reuse at zero compute cost; evidence: U-Net skips shown effective in some speedrun setups): val_bpb 1.229→1.254 WORSE. Skip connections interfered with existing x0 residual stream — two skip mechanisms compete rather than complement. The x0 lambdas already provide global gradient shortcuts; U-Net skips add redundant paths that dilute learned representations.
6a39bd5	1.245229	8.2	49.3	32596	606	239.3	4	3.090	discard	2 VE groups (layers 0-5 share VE1, layers 6-11 share VE2) instead of 1 shared VE (hypothesis: separate VE modules let early/late layers specialize different token→value mappings using 2.4GB VRAM headroom; evidence: multiple VE groups shown to help in some setups): val_bpb 1.229→1.245 WORSE. 239M params (+39M) but MFU dropped 53→49% and steps 670→606 (-10%). Extra VE embedding lookups are bandwidth-bound, slowing each step. The capacity gain from VE specialization doesn't offset losing 64 optimizer steps.
fa89372	1.234214	7.0	57.4	35176	655	200.7	4	3.003	discard	z-loss regularization 1e-4*logits^2.mean() (hypothesis: prevents logit drift for better convergence at zero throughput cost; evidence: PaLM/Gemma use z-loss): val_bpb 1.229→1.234 WORSE (delta +0.005). MFU 57.4% (good — no overhead). z-loss is redundant with softcap=30 which already bounds logits to [-30,30]. The extra gradient from z-loss slightly hurts optimization without providing new signal.
f6afe08	1.296943	7.0	56.9	34228	642	200.7	4	3.183	discard	HEAD_DIM 128→64 (6 heads→12 heads) (hypothesis: more attention heads = more diverse patterns at same FLOPs; evidence: SOTA small models use HEAD_DIM=64): val_bpb 1.229→1.297 MUCH WORSE. Smaller head dim reduces per-head capacity too much — 128-dim heads better capture position/semantic info via RoPE at 768 dim. More heads ≠ better at this scale.
0368d59	1.264137	7.0	53.7	35165	621	200.7	4	3.238	discard	parallel attn+MLP (PaLM-style: x = x + attn(norm(x)) + mlp(norm(x))) (hypothesis: both branches see same input enabling independent specialization + saves one norm per layer; evidence: PaLM/GPT-J use this): val_bpb 1.229→1.264 WORSE. Sequential residuals let MLP refine attention output which is critical — parallel blocks lose this sequential refinement at our scale.
edee52e	1.217980	7.0	53.0	35567	659	200.7	4	3.079	keep	softcap 30→15 (hypothesis: tighter logit cap provides stronger gradient signal near boundary for faster convergence + implicit regularization; evidence: empirical best practice for 50K vocab): val_bpb 1.229→1.218 (0.011 improvement). 659 steps vs 670 similar throughput. Confirms softcap=30 was too permissive — 15 better constrains logit range for 50K vocab.
f152558	1.229451	6.2	52.0	32779	620	200.7	4	3.153	discard	Muon beta2 0.95→0.9 (hypothesis: faster variance adaptation improves convergence; evidence: some practitioners report beta2=0.9 improves training): val_bpb 1.218→1.229 WORSE. Lower beta2 causes noisier updates that hurt training — 0.95 gives better smoothing for our 200M model. MFU also dropped 53→52%.
f8eb425	1.279678	6.0	49.0	24000	473	252.1	2	3.365	discard	ASPECT_RATIO 64→72 (n_embd 768→896, 252M params) (hypothesis: wider model uses 5GB VRAM headroom for more capacity; evidence: web search favors width over depth for short budgets): val_bpb 1.218→1.280 WORSE. Autotune dropped batch 4→2 killing throughput (31M vs 43M tokens). Width increase NOT worth it — batch size penalty dominates capacity gain.
6b09c74	1.226926	5.2	50.5	33766	627	200.7	2	3.055	discard	softcap 15→10 (hypothesis: tighter logit cap gives stronger gradient regularization since 30→15 gave +0.011; evidence: exp30): val_bpb 1.218→1.227 WORSE. Also autotune regressed batch_size 4→2 (stale cache?) which killed MFU 53→50.5%. Softcap=10 too restrictive — limits model expressiveness. Need to fix autotune cache.
c92e2ae	1.227580	5.2	50.9	34552	634	200.7	2	0.000	discard	AUTOTUNE_MAX_MEMORY_FRACTION 0.90→0.95 (hypothesis: higher memory limit lets autotune pick batch_size=4 again after stale cache regression; evidence: exp32 softcap=10 regressed batch 4→2): val_bpb 1.218→1.228 WORSE. Still batch_size=2 — autotune cache is the issue not the fraction. Need to delete cache and refresh.
8565a5a	1.235025	5.5	50.3	30328	556	214.9	2	3.157	discard	DEPTH 12→14 at same 768 dim (ASPECT_RATIO 64→54, 215M params) (hypothesis: deeper model converges faster per token in token-starved regime; evidence: scaling law research + landscape scan): val_bpb 1.218→1.235 WORSE. 556 steps/36M tokens vs 659/43M — 17% fewer tokens hurt more than 2 extra layers helped. Also autotune chose batch=2 (not 4) even with fresh cache for 215M model. Depth increase NOT worth it at this compute budget.
8167940	1.204070	4.9	55.6	38411	704	200.7	2	3.180	keep	FP8 training via torchao convert_to_float8_training (hypothesis: FP8 matmuls on Blackwell tensor cores increase throughput for more tokens in 20 min; evidence: landscape scan + torchao docs): val_bpb 1.218→1.204 (0.014 improvement). 704 steps/46.1M tokens vs 659/43M — 7% more tokens processed. MFU 55.6% (up from 53%). Despite batch=2 (autotune eager-mode issue), FP8 faster per step. Only lm_head excluded (50257 not div by 16).
b1b8753	1.186515	6.3	60.5	41708	765	200.7	4	3.080	keep	AUTOTUNE_MAX_MEMORY_FRACTION 0.90→0.98 (hypothesis: higher threshold lets eager-mode autotune accept batch=4 which compiled+FP8 mode can handle easily; evidence: compiled uses ~5GB at batch=2 vs eager ~8GB): val_bpb 1.204→1.187 (0.018 improvement). batch=4 restored! 765 steps/50.1M tokens vs 704/46.1M (+9% tokens). MFU 60.5% (was 55.6%). FP8+batch4 is a huge throughput win.
d0aa13e	1.190775	7.3	62.6	42548	791	200.8	4	3.143	discard	Pad vocab 50257→50304 for full FP8 coverage on lm_head (hypothesis: lm_head FP8 gives +4% throughput; evidence: lm_head is largest matmul excluded from FP8): val_bpb 1.187→1.191 WORSE (+0.004). Throughput improved 41.7K→42.5K (+2%) and MFU 60.5→62.6% but extra softmax width (50304 vs 50257) slightly hurts convergence. 791 steps/51.8M tokens. Throughput gain doesn't offset convergence penalty.
3f5b4d7	1.187941	6.3	62.1	41216	756	200.7	4	3.060	discard	FP8 tensorwise recipe via Float8LinearConfig.from_recipe_name('tensorwise') (hypothesis: tensorwise scaling has less overhead than default for 768-dim model; evidence: torchao docs say tensorwise is fastest): val_bpb 1.187→1.188 NO improvement (delta +0.001). MFU 62.1% same as default FP8. Tensorwise recipe is already the default behavior — no change.
a1d70b9	0.000000	0.0	0.0	0	0	0.0	0	0.000	crash	MXFP8 via torchao MXLinearConfig mxfp8_cublas (hypothesis: Blackwell-native block-32 scaling reduces FP8 overhead): CRASH — torchao cpp extensions incompatible with torch 2.9.1 ('torchao::mxfp8_quantize' CUDA kernel not found). Need torchao version matching torch 2.9.1 for native MXFP8 kernels.
5788fd7	1.184821	7.8	67.2	46386	849	200.7	4	3.008	keep	MXFP8 cuBLAS native training (Blackwell block-32 microscaling via torchao _C_mxfp8.pyd built from source with CUDA 12.8 nvcc sm_100a+sm_120; hypothesis: MXFP8 block-32 scaling uses dedicated Blackwell tensor core datapaths for higher throughput than standard per-tensor FP8; evidence: PyTorch blog 1.22-1.28x speedup on B200): val_bpb 1.187->1.185 (marginal) BUT tok/sec 41708->46386 (+11.2%); MFU 60.5->67.2%; 849 steps/55.6M tokens (best ever). MXFP8 cuBLAS is strictly better than standard FP8 on Blackwell.
3d3b084	1.203318	8.5	56.5	38423	708	201.3	4	4.743	discard	MTP auxiliary loss: predict t+2 from position t (weight 0.3) via residual mtp_proj Linear(768x768) + shared lm_head (hypothesis: MTP adds ~1.3x learning signal per token to improve data efficiency in token-starved regime 55.6M tokens/200M params; evidence: Meta MTP paper): val_bpb 1.185->1.203 WORSE. 17% throughput loss (46.4M vs 55.6M tokens) from extra lm_head computation NOT compensated by auxiliary learning signal. MTP overhead too expensive for 20-min budget — tokens-processed dominates over data-efficiency gains at this scale.
056d498	0.000000	0.0	0.0	0	0	0.0	0	0.000	crash	compile mode=reduce-overhead for CUDA graphs (hypothesis: reduce CPU dispatch overhead to boost MFU; evidence: PyTorch docs): CRASH — CUDA graphs overwrites embedding tensor outputs between iterations. Known incompatibility with nn.Embedding in reduce-overhead mode. Would need cudagraph_mark_step_begin() but that defeats the purpose.
4475d25	1.158602	8.6	79.4	53099	990	200.7	4	2.903	keep	selective MLP-only activation checkpointing (hypothesis: checkpoint only MLP ~2/3 of activations instead of full block to reduce recompute penalty; evidence: MLPs dominate activation memory while attention is cheap): val_bpb 1.185->1.159 (0.026 improvement). MFU 67.2->79.4% (+12%). tok/sec 46K->53K (+14%). Steps 849->990 (+17%). 64.9M tokens (best ever). Huge throughput win from eliminating unnecessary attention recompute.
0d9db40	0.000000	0.0	0.0	0	0	0.0	0	0.000	crash	weight tying + Gemma sqrt(n_embd) scaling with unembedding_lr=0.004 for tied weights (hypothesis: sqrt(d) scaling boosts embedding signal to compensate for low LR; evidence: Gemma paper): FAILED — loss stuck at 10.825 (random init) after 349 steps. 0.004 LR too low even with 27.7x embedding scaling. The tied weight needs dual-rate optimization (high for embedding role low for output role) which AdamW cant provide for a single tensor. Weight tying fundamentally incompatible with our separate embedding/unembedding LR architecture.
0dc2fe8	1.141604	8.6	84.3	62310	1132	200.7	4	2.940	keep	FlexAttention SSSL sliding window (9/12 layers use window=1024, every 4th full attention via flex_attention API) (hypothesis: slash early-layer FLOPs by ~35% while maintaining quality with full attention every 4th layer; evidence: Qwen/Mistral hybrid architectures): val_bpb 1.159->1.142 (0.017 improvement). MFU 79->84%. tok/sec 53K->62K (+17%). Steps 990->1132 (+14%). 74.2M tokens (best ever). flex_attention enables hardware-optimized sliding window kernels.
edfe472	1.146758	8.8	85.1	58308	1080	207.8	4	2.999	discard	Qwen 3.5-style gated attention: sigmoid gate Y*sigmoid(X@W_gate) before c_proj on all 12 layers (hypothesis: eliminates attention sink problem for faster convergence; evidence: NeurIPS 2025 best paper arxiv 2505.06708): val_bpb 1.142->1.147 WORSE (+0.005). Gate adds 7M params (+3.5%) and reduces throughput 62K->58K tok/sec (-6%) costing 52 steps. Quality gain from gating doesn't compensate for fewer training tokens in 20-min budget. Technique likely helps at larger scale/longer training but hurts in our token-starved regime.
fafaf6b	1.220257	7.7	84.5	61751	1136	168.7	4	3.092	discard	low-rank VE: Embedding(50257x128) + Linear(128x768) replacing full Embedding(50257x768) (hypothesis: rank-128 retains VE capacity while cutting 38.6M->6.6M params freeing VRAM; evidence: LoRA shows low-rank works): val_bpb 1.142->1.220 MUCH WORSE (+0.079). Same throughput (74.4M tokens) but capacity severely bottlenecked. Rank 128 too small to capture the rich token->value mapping that full-rank VE provides. The full 768-dim embedding is essential for VE quality.
0ff8984	1.157256	8.6	84.7	60082	1131	200.7	4	2.978	discard	WSD LR schedule: warmup 5% + stable 80% + linear decay 15% replacing cosine warmdown 50% (hypothesis: flat max LR until 85% forces more aggressive learning per token; evidence: Llama 3 and MiniCPM prove WSD outperforms cosine in token-constrained runs): val_bpb 1.142->1.157 WORSE (+0.016). Same throughput (74.1M tokens 1131 steps). 15% linear decay too short — model doesn't converge properly. Cosine 50% warmdown is better because gradual decay gives model time to settle into good minimum. WSD works for longer training budgets but not our 20-min constraint.
2f494d1	1.145821	9.6	82.4	57000	1070	200.7	4	3.076	discard	BF16 cross_entropy: removed .float() casts from logits+loss (hypothesis: softcap=15 bounds logits to [-15,15] making FP32 unnecessary; evidence: BF16 handles exp(15) fine): val_bpb 1.142->1.146 WORSE (+0.004). MFU 84->82% and tok/sec 62K->57K also regressed — removing FP32 precision hurts both convergence AND throughput (likely because compiled graph cant fuse BF16 CE as efficiently). FP32 logit casting is load-bearing for quality.
ef1b0c7	0.000000	0.0	0.0	0	0	0.0	0	0.000	crash	MXFP4 CUTLASS training (mxfp4_cutlass recipe) (hypothesis: FP4 block-32 microscaling doubles matrix throughput vs MXFP8; evidence: Quartet paper ~2x speedup): SKIPPED — web search confirmed CUTLASS 4.x builds are broken on Windows (known issue being fixed by CUTLASS team). mxfp4_cutlass kernels not available on our platform. MXFP8 cuBLAS remains best option.
114b9ee	0.000000	0.0	0.0	0	0	0.0	0	0.000	crash	Sparse MoE MLP: 4 half-sized SwiGLU experts with Top-1 routing (hypothesis: 2x capacity at same active FLOPs; evidence: Mixtral/DeepSeek MoE): CRASHED — init_weights expects block.mlp.c_gate but MoE has no direct c_gate attr. Deeper issue: boolean indexing for expert dispatch causes torch.compile recompilation (dynamic shapes); running all experts wastes 4x compute defeating sparsity purpose. MoE incompatible with our compile-heavy pipeline at 200M scale.
7d8719c	0.000000	0.0	0.0	0	0	0.0	0	0.000	crash	Gated DeltaNet hybrid 9/12 layers via fla library (hypothesis: linear attention replaces sliding window for O(n) complexity; evidence: Qwen3.5/ICLR 2025): HUNG — process alive 20+ min without progress. torch.compile + fla Triton kernels incompatible on Windows/Python 3.10. fla warns 'not adapted for Windows' and 'torch.compile not available in Python 3.10'. GDN requires native fla kernel compilation which hangs on triton-windows. Would need Linux or Python 3.11+ for this approach.
5f2b80c	1.154587	7.1	75.5	57000	1034	200.7	2	3.030	discard	FINAL_LR_FRAC 0.1→0.01 (hypothesis: deeper LR floor improves final convergence per arxiv 2509.01440; evidence: optimizer benchmark paper): val_bpb 1.142->1.155 WORSE (+0.013). Autotune regressed to batch=2 (stale cache from GDN crash) losing 9% tokens. Also 0.01 floor too aggressive for 20-min budget — model stops learning too early in warmdown. 0.1 floor is better for our short training.
